user_input,retrieved_contexts,response,reference,llm_context_precision_with_reference,context_recall,faithfulness,answer_relevancy
What did management cite as the main driver of Q3 revenue growth?,"['For the past 8 years, we have been the leaders in customer value creation for our industry. Overall, greater focus across each element of the fees resulted in both volume and value share gains, volume growth and more weekly plus drinkers during the quarter. In summary, it’s early in the year, and we know the external environment remains complex and it’s quickly evolved. However, we continue to benefit from 3 unwavering delay. One, — we are in great resilient industry. Two, we have a powerful portfolio as demonstrated by our $32 billion brand; three, our pervasive yet local system is a clear advantage. Moving forward, we will continue to invest in these beliefs and leverage our all-weather strategy to achieve our objectives. With that, I will turn the call over to John.\nJohn Murphy: Thank you, Henrique, and good morning, everyone. During the quarter, we navigated market dynamics locally to deliver on our global objectives. We grew organic revenues 10%. Unit case growth was 3%. Concentrate sales were 5 points ahead of unit case sales as the impact of 6 additional days in the quarter, was partially offset by the timing of concentrate shipments. Our price/mix growth of 2% was primarily driven by approximately 4 points of pricing actions partially offset by 2 points of unfavorable mix, which was primarily driven by 3 items: one, Easter timing and category mix in North America; two, stronger growth of value offerings from revenue growth management initiatives across Asia Pacific; and three, geographic mix in Latin America.\nComparable gross margin declined approximately 30 basis points, stemming primarily from commodity pressures in our tea and coffee businesses, phasing of inventory costs and timing of trade spend. However, comparable operating margin increased approximately 70 basis points, as we’ve realized operating expense efficiencies while investing further behind our brands. Below the line, we benefited from a combination of higher equity income, lower net interest expense and realized security gains in our captive insurance companies, which benefited comparable other income. Putting it all together, first quarter comparable EPS of $0.86 increased 18% year-over-year, helped by 3% currency tailwinds. Free cash flow was approximately $1.8 billion, an increase versus prior year.\nOur balance sheet remains strong with our net debt leverage of 1.6x EBITDA, which is below our targeted range of 2 to 2.5x. We’re continuing to judiciously manage our balance sheet as we await a court decision related to our ongoing dispute with the IRS. We’re confident in our long-term free cash flow generation and are prioritizing a capital allocation agenda that creates optionality to both reinvest in our business and return capital to shareowners. Enabled by our all-weather strategy, we’re on track to deliver on our updated 2026 guidance. We continue to expect organic revenue growth of 4% to 5%. We now expect growth in comparable currency-neutral earnings per share, excluding acquisitions and divestitures of 6% to 7%. Notwithstanding volatility in certain commodities like tea and coffee, we believe the overall impact on our cost basket is manageable at this time.', 'You’ll remember Lean Center a number of years ago, then we did a thing called emerging stronger coming out of COVID. So there are more episodic, more big events of moving the organization around. But each year, we’re looking for continuous improvements and continuous productivity. And as we think about what’s coming next, and you mentioned that a number of people have talked about restructuring, what we see going forward is, look, the industry is going to keep growing. We’re the leader, and we’re winning share. And what we need to do is to continue to fuel the top line growth. There was — if I diverge for a second, there’s a famous at least famous at Coke, speech that was written by the CEO of Coke, Robert Woodruff on the 50th anniversary, which is almost 90 years ago.\nIt was only 1.5 pages. speeches were shorter in those days. And he didn’t have a title. And he wrote on the title, the future belongs to the discontented. And I think that is the key feature of what comes. Yes, we’ve been growing. We’ve been winning in the marketplace. And it’s easy to be discontented if you’re not doing well and you’re under pressure from everyone else in the investor base. The hardest thing is to say, I’ve done well and be discontented enough with yourself that you know you need to change and you know you need to transform. So think of what’s coming as we’re going to continue to drive that top line revenue growth. We’re going to find the extra investments to drive that growth. And yes, we will be discontented with ourselves and think what do we need to continue, what do we need to evolve and what do we need to transform to generate those funds for growth.\nAnd that will include ongoing productivity as we bring in AI and Agentic tech over the coming years, and we’ll do some restructuring of the organization in the coming — in 2026. But this is all about replicating the game plan over the last 10 years of finding productivity through the whole P&L to invest and drive top line growth that falls to the bottom line.\nOperator: Our next question comes from Bonnie Herzog from Goldman Sachs.\nBonnie Herzog: I actually just had a quick question on your business in Asia. Organic sales in the quarter were up 7% and accelerated sequentially. So I guess hoping for some more color on the strength you’re seeing in the region and how sustainable the strong, I guess, high single-digit price/mix is?\nJames Quincey: Yes. Thanks, Bonnie. This falls into the bucket of one of the sporadic questions about how strange the Asia Pacific segment is. And what I would encourage is to look at multi-quarter trends in Asia Pacific because for management reasons, Asia, they’re all on a different time and it’s much easier to manage when you’re out there and you put them all together, but they are quite disparately different businesses. You’ve got the emerging market businesses with, let’s say, India at one end with huge, huge, huge potential for growth in volume over many, many years, but much lower prices, all the way through China, ASEAN and then at the other end of the spectrum, you get to Australia and Japan, which have been growing but have much higher realized prices given the developed economy.', 'Robert Moskow: Hi. Thank you for the question. John, I just wanted to get a sense of your level of conviction that concentrate volume returns to positive territory in the back half of the year. You know, there appear to have been some transitory elements negatively impacting Q2. And also a tough comp. And then secondly, just in terms of phasing, it would appear that the fourth quarter has a tough comp in terms of concentrate volume. Am I looking at that correctly? And is there anything that you can add to that? Thanks.\nJohn Murphy: Sure. So yeah. So we, you know, our guidance for the full year reflects a confidence that we will have positive volume growth in the second half of the year. I think you’re up to two quarters. Q3, we’re certainly cycling a more modest prior year. I think rather than overly focused on the prior year, I think our ability to influence the next six months is what’s most important. And if you know, if you look at Q2, and you take away a couple of the I would call them anomalies in some of the key markets. Yeah. There’s still pretty good underlying momentum in the business. We have the opportunity on the back of a stronger than expected first half on the profit front to have more optionality on how we continue to invest some of our efficiencies.\nWhich we plan to do. So we’ve got a robust second half on the investment front. Underlying trends in general are good, and a couple of the outliers that have been a headwind in recent months we are comfortable that they can get back on track.\nOperator: Ladies and gentlemen, this concludes our question and answer session. I would like to turn the call back over to James Quincey for any closing remarks.\nJames Quincey: Thank you, operator. So to summarize, we believe we’re well-positioned to deliver on our updated 2025 ambitions and guidance. We’re continuing to build our systems to drive long-term growth and we’re confident we will continue to create enduring value for our stakeholders. Thank you for your interest, your investment in our company, and for joining us this morning.\nOperator: Thank you. Ladies and gentlemen, this concludes today’s conference call. Thank you for participating. You may now disconnect.', 'We’ve also taken foundational steps to digitize our system. We’ve made good progress connecting with consumers and customers on a more granular and personalized level. And lastly, we’ve built a culture that prioritize our willingness to take risks, learn through iteration, push each other and scale successes. Our people and our growth mindset remain 2 of our biggest advantages. As a result of delivering on these 4 strategic priorities, we’ve had a 7% average organic revenue growth since 2017, above our long-term growth algorithm. After years of being stuck at around $2 comparable earnings per share, we inflected our earnings, overcame ongoing currency headwinds and have achieved a $3 comparable earnings per share in 2025. We also created more than $150 billion of market value for our shareowners and outperformed the consumer staples industry.\nOur foundation today is as strong as it’s ever been. No matter how you slice it by category, by consumer, by channel, we have immense growth opportunities ahead of us. Henrique will bring new energy to ushering our next chapter of growth, and he’s particularly passionate about our brands, franchise operating model, digital engagement and our people. We both started at the Coca-Cola Company in the same year over 30 years ago, and he’s been an invaluable partner to me over the past decade. He’s worked across many functions and has created value for our system on every continent where we do business. The best days for our system continue to be ahead of us, and I’m confident we’ll capture these opportunities under Henrique’s leadership. So without further ado, I’ll pass the call off to Henrique Braun, the next Chief Executive Officer of the Coca-Cola Company.\nHenrique Braun: Good morning, everyone, and thank you, James. I’d like to take a moment to thank you for your leadership during your tenure as CEO and for your incredible contribution to our system. You leave a legacy of returning our business to growth. It’s a privilege to be the next Chief Executive Officer, and I look forward to partnering with you in your ongoing role as the Chairman. Now I’d like to discuss our 2025 performance. Despite a complex external environment in 2025, we delivered on our initial top line and bottom line guidance set last February. We also continued our streak of gaining value share for the last 19 quarters. Organic revenue growth was in line with our long-term growth algorithm. While unit case volume was flat in 2025, we ended the year with better momentum as volume improved each month during the fourth quarter.\nIf you take a step back, we have a long track record of navigating complex external dynamics to hold or grow volume each year. Over the past 50 years, annual volume declined only once, and that was during the pandemic. Rounding out the P&L, ongoing efficiency and effectiveness initiatives drove strong comparable operating margin expansion in 2025, which contributed to 4% comparable earnings per share growth despite 5 points of currency headwinds and a 2-point increase in our comparable effective tax rate. During the fourth quarter, we grew volume despite cycling a tougher comparison versus the prior year. We continue to invest to build our system for the year ahead as well as for the long term. Starting with North America. We delivered strong results despite continued macroeconomic pressure on lower-income consumers.', 'Comparable gross margin and comparable operating margin both increased approximately 50 basis points. Both were driven by underlying expansion, partially offset by currency headwinds. Putting it all together, fourth quarter comparable EPS of $0.58 was up 6% year-over-year despite 5% currency headwinds and an increase in our comparable effective tax rate. Free cash flow, excluding the fairlife contingent consideration payment, was $11.4 billion in 2025, which is an increase of approximately $600 million versus the prior year’s free cash flow, excluding the IRS tax deposits. Growth was driven by underlying business performance and lower tax payments versus the prior year. Adjusted free cash flow conversion in 2025 was 93%, in line with our long-term targeted range for the third consecutive year.\nOur balance sheet remains strong with our net debt leverage of 1.6x EBITDA, which is below our targeted range of 2 to 2.5x. We’ll continue to judiciously manage our balance sheet as we await a court decision related to our ongoing dispute with the IRS. Enabled by our all-weather strategy, we have demonstrated our ability to navigate local market dynamics to deliver on our global objectives. Our 2026 guidance builds on the results we’ve achieved over the past several years. We expect organic revenue growth of 4% to 5%, which is in line with our long-term growth algorithm. We also expect growth in comparable currency-neutral earnings per share, excluding acquisitions and divestitures, of 5% to 6%. We continue to focus on investing behind our brands to drive balanced top line growth with volume as a key priority.\nNotwithstanding volatility in certain commodities and evolving global trade dynamics, we expect the overall impact on our class basket to be manageable. Divestitures are expected to be an approximate 4-point headwind to comparable net revenues and an approximate 1 point headwind to comparable earnings per share. This assumes the pending sale of Coca-Cola Beverages closes subject to regulatory approvals during the second half of 2026, and includes the impact of divesting CHI, which was our juice and value-added dairy finished product operations in Nigeria. Based on current rates and our hedge positions, we anticipate an approximate 1 point currency tailwind to comparable net revenues and an approximate 3-point currency tailwind to comparable earnings per share for full year 2026.\nOur underlying effective tax rate for 2026 is expected to be 20.9%. All in, we expect comparable earnings per share growth of 7% to 8% versus $3 in 2025. We also expect to generate approximately $12.2 billion of free cash flow in 2026 through approximately $14.4 billion in cash from operations, less approximately $2.2 billion in capital investments. Driven by our free cash flow generation, we have an unwavering commitment to reinvest in our business and grow our dividend. Approximately 25% of our expected 2026 capital investments related to company-owned bottlers and the remaining capital investment is primarily growth oriented, which includes building capacity for our concentrate and finished goods businesses. For the past 63 years, we’ve grown our dividend.', 'John Murphy: Sure, Chris. Let me start with the overall gross margin profile. Q1 was somewhat anomalous given one particular item in APAC, the phasing of juice inventory costs, particularly in China. And that’s really as a one-off in the quarter. We have had commodity pressures in the tea and coffee space, and that’s going to continue somewhat through the year. But at the overall level, if I take a step back and look at the underlying drivers of gross margin for the full year, we don’t see a big deviation from the playbook that we’ve had. We’ll — we see the revenue growth management architecture work as a very solid foundation to sustaining margins. We continue to drive a lot of efficiency throughout the P&L. But on the cost front, we’ll be taking a number of measures to somewhat mitigate against some of the commodity pieces I talked about earlier, which I said are manageable.\nSo for the full — I don’t see it as being an area that’s going backwards, the gross margin trends when I take out that inventory issue I mentioned we’ve got a lot of levers to work through and both as a company and as we alluded to earlier as a system. With regard to the CCBA piece, just it’s a mechanical topic in terms of the impact it will have to the margin profile of the company. If we take CCBA’s numbers out, lower-margin bottling business will automatically result in the overall company margin profile improving. And we’ve highlighted that to be a second half of the year topic. For ’26, too, we can say for — which is anomalous relative to other years FX will be a slight tailwind on the margin front, too. Thanks.\nOperator: Our next question comes from Robert Ottenstein from Evercore.\nRobert Ottenstein: Great. Congratulations on a great start to the year and your tenure. I was wondering if you could go into a little bit more detail on the underlying drivers of your performance in APAC, particularly China and India, 2 years in a row of good — very strong results. How sustainable is this do you think throughout the rest of this year and going forward? And what are you doing differently now than in the past to produce such strong results?\nHenrique Braun: Thank you, Robert. We in APAC, we’re pleased with the volume growth across operating units in there. We also pleased with the fact that we gained share overall in the region. But there is still a lot of work to be done. And the reason why I’m saying that is because it’s one region that we’re developing definitely for the future. The big majority of the countries in there are still under development stage. If take a site like Japan, Korea, Australia, that are in a different stage. But everything else in a huge population in there, it’s equally important that we not only deliver on the volume growth, but we built this industry for the future. So we’re really focused China and India, as you mentioned, on developing first the industry and the foundations of our business as we’ve learned in other parts of the world with the right price package, architecture, playing where we believe we can win and then continue to expand that for it.']",Management cited approximately 4 points of pricing actions partially offset by 2 points of unfavorable mix as the main drivers of price/mix growth in Q3. (Source: [4] and [47]),Volume growth in the premium beverage segment and pricing actions in LatAm.,,,,
How much did the company say it increased digital marketing spend?,"['That’s just to give you an idea about that investment. And we will continue to invest because this is a market for the future. We’re still building the industry in there. And that’s why we need to continue to invest ahead of the curve, because it’s more — almost on the model that build and will come, right? Because really on this market, you can actually continue to push forward. Digital, it’s part of it. It continues to be an opportunity in India. Why? Number one, because digitally speaking, the country infrastructure is pretty high, as well as being an acceleration across the whole India in the last few years. And we also invested behind it with a lot of focus on not only engaging with the consumer through data, tech and AI, but also from a customer point of view, developing a platform that we call Coke Buddy, which is a platform that connects the bottler to the customers through a digital platform that has been growing from day 1.\nWe’re still at 1/4 of the entire outlet base that we can reach in India, but we think that we are already deploying digital ordering, AI, agentic AI, to determine the next best SKU. And the next phase of that growth will be an end-to-end digital platform that will connect not only the consumer, the customers, but the experiences, to translate that engagement into transactions. So India, for those reasons, is a market that, on that space, it’s going to continue to be ahead of the pack as well.\nJames Quincey: Great. Thanks very much, everyone. To summarize, we are well positioned, I think, to achieve our objectives both in 2026 and the long term. It’s a great foundation that’s been set. As we’ve talked, this is the time for a seamless leadership transition and I have every confidence Henrique is the best person to help lead the Coca-Cola Company, the team and the system on our next chapter of growth. Thank you very much for your trust, your investment in the company and for joining us this morning.\nHenrique Braun: Thank you, James.\nJames Quincey: Yes.\nOperator: Ladies and gentlemen, this concludes our conference call. Thank you for participating. You may now disconnect.', 'Also, in North America, we launched the Bring the Juice campaign, which featured a collaboration between Minute Maid and World Wrestling Entertainment that includes digital experiences, limited-time-only packaging, and in-store activations. Our innovation agenda supports our overall growth strategy by focusing on understanding and anticipating consumer needs. To make a greater impact and improve return on investment, we’re leveraging our portfolio of thirty billion dollars brands. For example, during the quarter, we launched Sprite plus Tea in North America, which contributed to increased share of visible inventory. This limited-time-only innovation blends the refreshment of Sprite with the flavor of tea and adds to the recent hits under the Sprite trademark, including Sprite Chill, Sprite Winter Spiced Cranberry, and Sprite Lemonade.\nSprite Plus Tea started as an experimental project. We scaled the launch after seeing strong consumer demand and positive social media reaction. As a result of on-brand innovation, Sprite became the number three sparkling soft drink brand in the US as Beverage Digest announced in April. We’re always exploring ways to meet evolving consumer preferences for great-tasting refreshment, including with our iconic Coca-Cola brand. As you may have seen last week, we appreciate the president’s enthusiasm for our Coca-Cola brand. And as part of our ongoing innovation agenda, this fall in the United States, we plan to expand our trademark Coca-Cola product range with US cane sugar to reflect consumer interest in differentiated experiences. This addition is designed to complement our strong core portfolio and offer more choice across occasions and preferences.\nRevenue growth management is a critical tool to segment our consumers and channels, and we’re increasingly integrating the capability with our marketing expertise to drive transaction growth. To step up our capabilities, we are leveraging learnings across our markets and marrying digital investments with clear compelling points of sale, messaging in stores, and on packs. It takes patience and discipline to build a refillable franchise. We’re tapping into learnings from our strong capabilities in Latin America to grow refillables over the long term in Africa, the Philippines, Thailand, and parts of Eurasia and the Middle East. On the premiumization side, we’re leveraging our experience in North America to grow many accounts in Europe. And finally, last year, we highlighted an AI-based pack price channel optimization tool in Mexico.\nResults so far have shown this tool improves our offerings and speed to market. So far, we scaled this platform to eight markets across four operating units. Lastly, robust local execution is key to ensuring the success of our top-line initiatives. Our system is stronger than ever, which ultimately leads to commitments to further invest to drive growth. We’ve collectively ushered in a culture of learning from one another, and we aspire to improve every aspect of how we do business. To summarize, while the external environment continues to be dynamic, and there is no doubt that much uncertainty remains in the downhill, we remain growth-oriented. We’re continuing to pivot our plans as needed, and we are harnessing our all-weather strategy to deliver on our growth ambitions.\nBefore I conclude, I’d like to recognize the efforts and unwavering dedication of our system employees around the world. With that, I’ll turn the call over to John.', 'And that’s where we believe that we can make a bigger difference. When I say that we want to be closer to the consumer, is to understand them from a local point of view and not miss that opportunity to start in a local market, something that can turn into a $1 billion brand later and then scale. We have put a lot of efforts in discipline on how to grown the brand, learn how to grow them, and leverage scale. Now it’s about bringing more of those localness opportunities into the family and then accelerate. To that extent, you know that we announced today as well 2 more billion-dollar brands to the family, so innocent and Santa Clara from Mexico. That’s a great example of something that started locally. And then we’ve invested behind it. Now the bigger brands and a lot of the learnings from that can be turned into other places to bring more brands to that family.\nSo more next week, but that’s the idea. It’s an evolution for where we are with an acceleration of innovation being more accretive to the LTGA.\nOperator: Our next question comes from Carlos Laboy with HSBC.\nCarlos Alberto Laboy: James, John, Henrique, thank you for the focus, clarity and the growth. You previously said that you reinvest capital you raised from refranchising back into those markets. Should we expect a step-up in marketing and innovation investments in India? On a related basis, can you discuss for India the extent of the digital investments that you’ve been able to make in B2B platforms and advanced analytics and so forth for the purpose of more granular execution by point of sale before you refranchise? And what’s your vision for how the demand fulfillment capability is going to evolve there?\nHenrique Braun: Carlos, great to hear for you. So let me step back here because it’s not only about India. I think it’s a strategy that has been working for us. And John mentioned 2 questions before that this idea of investing together, bottlers and us, ahead of the curve. It’s, number one, showing the belief that the system has in this industry. And on top of that, that we invested that same idea in every market we operate in. That’s very unique from the core. Every market has one mission and it’s important. So India, specifically speaking, we not only have been investing with our bottling partners ahead of the curve. I think we mentioned a few quarters back the level of investment that we had on new lines in India that has been unprecedented.', 'We also focused on refillable packaging and driving availability. In China, we activated our broad portfolio and stepped up execution in targeted channels during the Chinese New Year. In India, we drove affordability and linked to our brands to consumer passion points, for instance, by connecting terms up with the T20 Cricket World Cup. We also expanded strike into more rural regions with content tailored to local languages. Lastly, in Japan, we gained value share by doubling down on consumer needs. We grew volume across our key brands with Georgia Coffee, we refined our package options to address different drinking occasions. In summary, we’re adapting our execution as needed and focusing on improving performance across all dimensions of our strategic growth flywheel to recruit consumers and drive balanced long-term growth.\nAt CAGNY, I discussed how we are becoming even more consumer and customer-centric by applying the for eyes, inside, innovation, intimacy and integrated execution. Levering data and our digital capabilities are unlocked to be much more precise in how we serve consumers and customers. Here are a few examples of the 4 eyes in action this quarter. In Europe, in select markets, approximately 60% of adult drinkers monitor Cathrin intake in the evening. To capture incremental drinker occasions, we relaunched Coca-Cola Zero-Zero, which offers 0 sugar, 0 cafe and 0 calories with a new visual identity, expanding availability and activations tied to the evening meals occasion. Coca-Cola Zero-Zero had a strong trial, positive repeat rates and contributed to the trademark of a Coca-Cola growing volume in Europe.\nFor Sprite, we recently launched our global campaign. It’s dead fresh, which includes partnerships across music, basketball, price food and fashion. We’re also scaling and launching products tailored to local need. In China, we launched Sprite prebiotic and lifted and shifted Sprite from North America. In the resin the Middle East, to refresh consumers during Ramadan, we are linking Sprite Lemon Mint to local festivities and key drinking occasion. Globally, Sprite had strong volume growth. Finally, Fuze Tea, which is available in more than 80 markets, appeals to consumers who are looking for greater balance. While we execute Fuze Tea made of Fusion campaign globally to scale the brand, we deliver intimacy with a highly localized product portfolio tailored to taste profiles, key types and 0 sugar options.\nIn Turkey, for example, we accelerated growth by emphasizing peach lemon, watermelon and dragon fruit flavors, along with strong activation during Ramadan. Globally, Fuze Tea grew volume double digit. It goes without saying that marketing and innovation do not come to life without commercial excellence. And our system is working towards mastering the fundamentals of integrated execution to drive customer value creation. In the past year, our system added more than 600,000 outlets, which increased outlet coverage. To drive basket incidents, we increased our share of visible inventory and grew off-the-shelf points of interruption by double digits to capture impose purchase. To drive transactions our system also placed over 340,000 units of cold drink equipment.', 'For the past 8 years, we have been the leaders in customer value creation for our industry. Overall, greater focus across each element of the fees resulted in both volume and value share gains, volume growth and more weekly plus drinkers during the quarter. In summary, it’s early in the year, and we know the external environment remains complex and it’s quickly evolved. However, we continue to benefit from 3 unwavering delay. One, — we are in great resilient industry. Two, we have a powerful portfolio as demonstrated by our $32 billion brand; three, our pervasive yet local system is a clear advantage. Moving forward, we will continue to invest in these beliefs and leverage our all-weather strategy to achieve our objectives. With that, I will turn the call over to John.\nJohn Murphy: Thank you, Henrique, and good morning, everyone. During the quarter, we navigated market dynamics locally to deliver on our global objectives. We grew organic revenues 10%. Unit case growth was 3%. Concentrate sales were 5 points ahead of unit case sales as the impact of 6 additional days in the quarter, was partially offset by the timing of concentrate shipments. Our price/mix growth of 2% was primarily driven by approximately 4 points of pricing actions partially offset by 2 points of unfavorable mix, which was primarily driven by 3 items: one, Easter timing and category mix in North America; two, stronger growth of value offerings from revenue growth management initiatives across Asia Pacific; and three, geographic mix in Latin America.\nComparable gross margin declined approximately 30 basis points, stemming primarily from commodity pressures in our tea and coffee businesses, phasing of inventory costs and timing of trade spend. However, comparable operating margin increased approximately 70 basis points, as we’ve realized operating expense efficiencies while investing further behind our brands. Below the line, we benefited from a combination of higher equity income, lower net interest expense and realized security gains in our captive insurance companies, which benefited comparable other income. Putting it all together, first quarter comparable EPS of $0.86 increased 18% year-over-year, helped by 3% currency tailwinds. Free cash flow was approximately $1.8 billion, an increase versus prior year.\nOur balance sheet remains strong with our net debt leverage of 1.6x EBITDA, which is below our targeted range of 2 to 2.5x. We’re continuing to judiciously manage our balance sheet as we await a court decision related to our ongoing dispute with the IRS. We’re confident in our long-term free cash flow generation and are prioritizing a capital allocation agenda that creates optionality to both reinvest in our business and return capital to shareowners. Enabled by our all-weather strategy, we’re on track to deliver on our updated 2026 guidance. We continue to expect organic revenue growth of 4% to 5%. We now expect growth in comparable currency-neutral earnings per share, excluding acquisitions and divestitures of 6% to 7%. Notwithstanding volatility in certain commodities like tea and coffee, we believe the overall impact on our cost basket is manageable at this time.', 'We gained both volume and value share and grew volume, revenue and comparable operating income. We had broad-based strength across our total beverage portfolio as trademark Coca-Cola, Sprite Zero, Fresca, Dasani, fairlife, BODYARMOR trademark and Powerade each group volume. Innovation contributed to our growth as Sprite Chill and Coca Holiday Creamy Vanilla had strong performance. Across our portfolio, our system focused on accelerating cold drink equipment placement, expanding availability of value offerings and winning share of visible inventory. In Latin America, we are lifting and shifting learning from across our markets and leveraging our systems capability to navigate a challenging external environment. During the fourth quarter, we managed to gain value share and grow volume, revenue and comparable currency-neutral operating income.\nBoth Coca-Cola Zero Sugar and Sprite Zero Sugar had strong performance. In Santa Clara, our value-added dairy brand in Mexico, became another addition to our stable of billion-dollar brands. To drive consumer demand, we tapped into key passion points by linking Fanta with Halloween. We also continue to focus on refillable packaging, value offerings and attractive absolute price points across our portfolio. In EMEA, we gained value share and grew volume and revenue. In Europe, volume declined as the quarter started slowly before recovering. To drive transactions, we activated several campaigns focused on the holiday and the upcoming Winter Olympics. In the U.K., we leveraged our English Premier League partnership to engage consumers with customized product offerings.\nIn Italy, to kick off the Winter Olympics Torch Relay, we launched a music festival in Rome. And our Coca-Cola truck followed the Olympic flame across key towns and cities ahead of the games. In Eurasia and the Middle East and in Africa, we grew volume in both operating units. We tapped into key innovations grounded in local consumers in sites like Sprite Lemon & Mint in the Middle East and had impactful marketing campaigns like Schweppes Born Social 2.0 and Cherry Coke in Nigeria. Our efforts to highlight the localness of our system and sharpen our revenue growth management capabilities led to volume growth in both operating units in 2025. Lastly, in Asia Pacific, we gained better share and had flat volume. However, revenue and profit declined during the quarter.\nVolume growth in Japan was offset by declines elsewhere, driven primarily by softer consumer spending, weaker industry performance and cycling a strong growth in the prior year. We are continuing to invest in long-term growth opportunities across Asia Pacific, and we are implementing granular channel execution plans and tailoring our brand price pack architecture with a focus on attractive absolute price points and value offerings. In summary, we are responding to different dynamics across our markets by adapting faster, leveraging our portfolio power and investing for growth. As I prepare to step into the CEO role and think about what’s next, there will be a balance between continuing what’s working, evolving where we can to become more effective and efficient.']","I don't know. The provided context does not mention an increase in digital marketing spend, but it mentions various investments in digital platforms, AI, and advanced analytics across different markets, including India.",Roughly 18% year over year.,,,,
